text,mark
"Очень красивый отель, что внутри , что с наружи!! Персонал внимательный, вежливый!! Советую побывать в этом отели!!",5
"Прекрасный, новый отель, всё на высшем уровне",5
"К сожалению бы разочарован данным отелем, после заселения в номере, решил принять ванну был обнаружен волос",1
Номер ресторан,5
Твёрдая 5-ка!,5
"Прекрасный отель, персонал. Все было превосходно. Завтраки лучшие 🔥🔥🔥",5
"Замечательный качественный отдых, дающий возможность восстановить силы, получить возможность расслабиться.",5
Отлично,5
Лучшее место для отдыха и проведения мероприятий,5
"Шикарно, рекомендую",5
"Прекрасный большой отель! Оставались там 08.09.24 в мой день рождения. Большой чистый и просторный номер. Персонал был приветлив и отзывчив. Обещали комплимент в честь ДР, но видимо забыли, но это не смогло омрачить прекрасного пребывания в этом отеле. Не много смутила стоимость парковки 1500 ₽ на сутки. С удовольствием вернемся сюда еще раз!",5
Отличный отель!,5
"Отель очень красивый. В номере все чисто, аккуратно, все работает, всего хватает, хорошая шумоизоляция. Водичка и чай каждый день пополнялись. Вкусно пахнет на этажах и в холле. Девочки на ресепшене дружелюбные и отзывчивые. На территории отеля красивый парк. Прочитали заранее, что парковка платная, поэтому прилетели на самолете 😅 Общие впечатления - хорошие.",5
"Все понравилось, из номера даже выходить не хотелось, все продумано до мелочей 💯",5
"Отличный отель в центре Москвы. Много где были и многое повидали. Все хорошо,рядом станция метро, ботанический сад. Отель порадовал обслуживанием, отличные завтраки. Обычно пишут что не понравилось, в этом отеле понравилось все. Немного огорчил платный паркинг. При бронировании отеля об этом не было информации и при заселении получился неприятный сюрприз. Помогли работники отеля быстро решить этот вопрос, большое им спасибо! В целом все хорошо и нам очень понравилось.",5
"Очень красивый, классный отель. Приятный персонал. На завтраках встречала и приветливо всё рассказывала София. Спасибо за оказанные услуги, приятное настроение и красивый вид.",5
"Как всегда, отель безупречен! Отличный номер, сервис, завтрак. Прекрасно провели время, обязательно вернёмся",5
"Отличный отель! Все безупречно! Номер шикарный , дорогая отделка, просторный , 48 кв. Ванная комната просторная. Вид из окна отличный, парк.метро пару минут вдоль парка. Заезд для такси отличный , ожидание : лавки с видом на парк. Завтрак разнообразный, не могу представить, чего не хватает для завтрака. Выпечка, качество блюд безупречно. Каждое блюдо вкусно! Единственно , что не понравилось . Это ресторан китайской кухни на 1 эт, блюда на 3 и еще 10% чаевые. Ты и так расстроен качеством блюд , а тебе еще и карандашом в чеке написали : заплати 1000₽.",5
"Отель супер! Все понравилось: и еда,и обслуживание,и номер. Все чисто и красиво! Рекомендую",5
"Отличный отель, хорошие просторные номера. Приветливый персонал, красивая территория отеля.",5
"Плюсы: Хорошие чистые номера, хороший завтрак, хорошее расположение, в общем почти все то, что ожидаешь от пяти звезд присутствует. Минусы: - в душевой кабине оказались использованные средства гигиены (их заменили после обращения). - не особо внимательный персонал. Остановились с супругой для празднования годовщины. Я заранее звонил в отель, сообщил, что особый повод, и уточнил, что я могу сделать чтобы получить номер на этаже повыше и видом на парк. Сотрудники попросили оставить комментарий и обещали сделать все возможное, а так же обещали сделать комплимент по случаю. В итоге: номер на 9 этаже с видом на шоссе (который после доплаты превратился в нужный на 19 этаже...) Ну и решили обойтись без комплиментов... Если откинуть невнимательность персонала, то отель вполне хороший. Твердая четверка.",4
"Шикарный отель, номера большие и очень удобные , завтраки превосходные.Все понравилось .",5
Прекрасный отель! Очень понравилось,5
"отличный отель, все чистое, новое, есть ванна в номерах, сам номер большой и просторный, рядом красивый небольшой парк, заселили быстро, поставили доп кровать ребенку за что отдельное спасибо! и принесли детский набор для душа и детские халат и тапочки)) единственный минус - кондиционер, дует холодным воздухом в режиме 22 градуса, а поднимаешь до 23 - выключается, режима fan нет, только охлаждение, поэтому ночью дуло в лицо, спасла маска для сна",5
"Отличный отель, хорошие современные номера, чистая паркова, современный дизайн отделки и наполнения, в номере есть все необходимое. Отель находится в живописном месте, рядом парк, ВДНХ, метро и все необходимыек магазины. Отдельного внимания заслуживает шведский стол, все очень вкусное и свежее. Буду сотанавливаться в нем не раз. Благодарю.",5
"Прекрасный отель. Бронировали номер на завтраках. Еда очень разнообразная и вкусная, шведский стол, даже шампанским с утра можно побаловать себя. Номера огромные, чистые, красивые, современные, технологичные. В номере есть рабочая зона, зона отдыха, прекрасный вид, отличная звуко- и шумоизоляция, понорамная ванна и огромный санузел, даже гладильная доска с утюгом имеются прямо в номере. Продумано всё до мелочей, что облегчает и украшает времяпровождения. Очень любезный и приветливый персонал. Перед входом располагается прекрасный китайский ботанический сад со свободным входом, там тоже можно погулять и отдохнуть. Рекомендую данный отель. Впечатления на 5+. Обязательно приедем ещё.",5
"Красивый отель с красивым парком. Вкусные и разнообразные завтраки - шведская линия огромна, кофе и свежевыжатые соки очень вкусные. Номер чистый, просторный. Окно открывается на проветривание, кондиционер тоже работает отлично. Теплые полы, ванная и душевая 👍 Весь персонал заботлив и внимателен.",5
"Как всегда, все на высоте! Спасибо персоналу! Спасибо за гостеприимство! Отель отличный, сад прекрасный! Вернемся еще раз!",5
"Кондиционер плохо работал, очень слабо Все остальное на высоте! 5 звёзд",4
"Отель твердая 4 с плюсом. Внутри очень красиво, люстра шедевральна. Элементы декора прекрасны. Номер огромный, гармоничный, постельное белье хрустит от чистоты, матрас хороший. Завтрак вкусный, очень разнообразный, персонал в ресторане внимательный и хороший. Омрачило впечатление, что при заезде в номере был плохо убран ковролин, валялся мусор под столом, грязное полотенце с пятном, плохо вымытые стаканы и зеркало в ванной с разводами. Дверь в шкафу сломана, плохо закрывается, ощущение пыли. Все это в номере 703. Ковролин в коридоре на 7ом этаже весь в мусоре. В любом случае большое спасибо за гостеприимство!",5
"Потрясающий отель , вот идеально все , номер, завтрак ) просто 10 из 10",5
"Прекрасный отель, отличный сервис и номера, идеальные матрасы и подушки, хорошая косметика и бесподобный завтрак!!!!!!!",5
"Высокое качество обслуживания, современные интерьеры, хотелось бы больше кафе и ресторанов внутри.",5
"Отличный отель! Качество , сервис, и завтрак!",5
"Хороший отель, приветливый персонал. С детьми отдыхали без проблем.",5
"Отличный отель , прожили почти две недели, доброжилпательные работники отеля, хорошее качественное обеспечение.",5
"Отель отличный, стоит ненамного дороже отелей на Тверской, только на Тверской за аналогичную стоимость - отель из квартир на третьих этажах без лифта, без завтрака, а здесь - удобство и отличный шведский стол на завтрак. Номер большой, красивый, отличные высокие кровати с удобными матрасами, вид оз окна прекрасный: сад из камней и огромный парк. Мы жили на 10 этаже. Между комнатой и ванной - смарт-стекло, все необходимые мелочи на месте: шампунь, гель, кондиционер, зубная паста с щётками, мыло, ватные палочки, диски, даже соль для ванны была. Душ и туалет отделены от ванны и друг от друга кабинками. В номере чайный уголок: небольшой чайник 0.6, кружки, чай зеленый/чёрный, вода с газом/без, кофе, сливки, сахар и что особенно понравилось - заменитель сахара. Каждый день подкладывали по печенюшке и конфетке на каждого, мелочь, а приятно. Завтрак отличный, всё есть: яичница, каша, сырники или запеканка, творог, фрукты консервированные и свежие, вафли, рыбка, шампанское. Есть блюда и китайской кухни, в разные дни разное. Были и китайские пельмешки с креветками, маринованные яйца, огурцы, лапша, свинина/курица в азиатских соусах. Мне больше всего понравилась запеканка с шоколадом, чурросы, особенно, если нутеллу добавить, и курочка в соусе, повару привет)) выходишь из отеля - сразу сад Хуамин в китайском стиле, тоже своего рода достопримечательность. Очень красивые расписанные беседки-пагоды, но больше всего понравился прудик, потому что в нём лотосы; перегибаешься через перила - и неожиданная красота) в общем, всё классно, до метро идти 5 минут прогулочным неспешным шагом, до ВДНХ 15 минут к противоположному от главного входу через леоновскую рощу. В следующий раз тоже тут остановимся.",5
"Шикарный отель, с великолепными интерьерами. Огромный номер, с шикарной ванной и душевой кабиной. Огромная удобная кровать. Панорамные окна . Красивый сад в японском стиле . Отдельная звезда -за удобное рабочее место, с видом через затемняющееся стекло на принимающую ванну жену",5
"Очень все понравилось, номера, кухня, расположение. Классные кровати и матрасы, постельное белье, оснащение номера. Из идеальной картины только выбивался долгий рум сервис вечером, бокалы и тарелки ждали больше 40 минут.",5
"Останавливались семьей для посещения ВДНХ. Отель вызывает только восторженные эмоции и положительное впечатление! Удобство кроватей заслуживает наивысшей оценки, как и вид с 14 этажа. Очень приветливый и отзывчивый персонал! Рядом уютный парк, можно расслабиться и даже заняться йогой. Разнообразные завтраки, вкусный кофе! Рекомендую!",5
Один из лучших отелей Москвы! Рекомендую!,5
"Отличный отель! Очень приветливый и вежливый персонал, номера прекрасные, завтраки шикарные. Уборка в номерах каждый день. Рядом с метро. Красивый китайский парк перед отелем. Только прекрасные впечатления, хочется возвращаться и возвращаться.",5
Хороший отель 👍,5
"Очень красивый, чистый отель. Отличное расположение. По парку минут 15 пешком до ВДНХ. До метро минут 7. Рядом ботанический сад и китайский сад. Завтраки шикарные. Номер красивый, чистый, со всем необходимым. В связи с предстоящим юбилеем бесплатно повысили категорию номера. Это круто. Спасибо большое. Вернёмся только сюда",5
"Очень хороший современный отель. С парковкой , отличными завтраками и вежливым персоналом! Метро в пяти минутах ходьбы. Прекрасный китайский парк на территории.",5
"Прекрасный отель. Красиво в отеле и парке. Была вечером в ресторане, очень вкусно, красивая посуда, радушный прием персонала. Завтраки это отдельный вид искусства, с игристым, свежевыжатым соком, смузи, станции с китайской и европейской едой. Хостес очень внимательные, на входе в ресторан проводят экскурсию, предлагаю кофе. Поздравили с днём рождения.",5
"Достойно, красиво, удобно.",5
"Жили в люксе Лотос. Отель просто супер! Чистый, красивый, свежий! Всё необходимое есть в номере! Завтраки отличные. Территория отеля очень красивая. Месторасположение хорошее, от метро 5 минут, до ВДНХ пешком. Если не хотите кушать в ресторане, есть «перекресток» рядом через дорогу. Однозначно рекомендую! Спасибо!",5
"Очень свеженький приятный отель. Такая полноценная 5ка. Хороший персонал, быстро реагируют на просьбы и пожелания. Завтраки понравились всем членам семьи с разными вкусовыми предпочтениями) Есть парковка 👍🏼 до парка 10 минут ходьбы.",5
Уровень отеля очень высокий. Номера продуманны до мелочей. Чувствуется класс. Отель стоит своих денег,5
Всё супер! Жаль автостоянка стала платной...,5
"Очень все понравилось 🙏 Благодарю администрацию отеля за 🎁 подарок, безумно приятно ❤️ Всем рекомендую 🔥",5
Очень приличный отель!,5
"Очень понравился отель. Номера просторные чистые. Вкусный и разнообразный завтрак. Перед отелем есть зона отдыха в восточном стиле, где можно прогуляться .",5
"Отель супер. Очень просторные номера. Хороший напор в душе(что не в многих отелях 5 звезд есть!) и в целом ванная очень приятная. Кровать реально была king-size, очень удобная. Рядом ВДНХ и Ботанический сад . Всем рекомендую.",5
"Очень красивый и роскошный отель. Останавливалась на 1 ночь в самом простом номере, но в нем все было отлично: огромный номер, шикарный вид, ванна с солью для ванн, удобный рабочий стол, достаточно большая кровать (queen size), все чисто, ничего не сломано, в телевизоре много каналов, есть растворимый кофе и вода. Единственный минус: очень шумел кондиционер, поэтому я его выключила. Также было хорошо слышно пробегающих по коридору детей, но это было всего пару раз за день, и мне это не помешало. К сожалению, не успела воспользоваться услугами ресторанов и тренажерного зала, поэтому о них ничего не могу сказать. Для информации: За раннее заселение (в 9 утра) взяли чуть больше половины стоимости номера.",5
"Классный отель. Огромные, уютные номера. Отдельное спасибо за ванную комнату. Завтра очень разнообразный и на уровне)",5
Один из лучших отелей Москвы и Московской области,5
"Хороший 5 звездочный отель, прекрасный интерьер, великолепный большой номер, удобная кровать, рабочий стол, большая ванная с душем, мне очень понравилось, советую, для размещения!",5
Отличный отель.Прекрасные номера. Единственный минус нет своего бассейна,5
Отель очень красивый😍 интерьер просто шикарный. Ванная комната оснащена и душем и ванной. Завтраки вкусные и разнообразные🥰,5
"Шикарный отель, обслуживание прекрасное. Все новое, чистое. Отмечала день рождения, очень довольна",5
Отличный отель! Твердая 5*.,5
"Новый отель! Шумоизоляция порадовала, с персоналом вопросов не было. Только добейте климат систему в номере и свежий воздух",5
Гостиница современная. Хороший тренажерный зал. Еда очень разнообразная. Также можно отдохнуть и сходить в ботанический сад насладиться приятными ощущения. Гостиница спокойная и располагает чтобы в ней остановится .,5
"Хорошее место, и отдохнуть и поработать )",5
"Отличный отель для утра невесты и не только. Все очень красиво и эстетично. Замечательный персонал, который придет на помощь абсолютно в любом вопросе лишь бы вам было комфортно. Очень все понравилось",5
В отеле парковка платная -1500 р. сутки. В остальном всё на высоком уровне.,4
"Всем привет, замечательный отель, есть беговые дорожки, хороший дизайн как снаружи так и с нутри, есть озеро, вечером отлично прогуляться пешком перед сном)нам с супругой понравилось, запоминающий отзыв могу оставить, советую посетить)",5
"Уровень, корейского Лотте 5 из 5, так держать! Очень понравилось, будем заезжать при возможности!",5
