text,mark
"Замечательный отель! Вкусные завтраки, уютные и комфортные номера, продуманы все мелочи! Обслуживание тоже на высоте. Метро в шаговой доступности.",5
"Прекрасный отель, отличные номера и не менее замечательный завтрак. Быстрая и удобная логистика с Шереметьево, а после насыщенного дня через 10 минут уже можно гулять по вечернему вднх",5
"Отель новый, чистый, номера отличные. Минус - ресторан в лобби. Очень медленное обслуживание, завтрак занял час.",4
Хороший отель 5⭐ Тщательно продуман для маломобильных групп населения. Рядом с отелем китайский ландшафтный парк Хуаминюан.,5
"Лучшая гостиница Москвы, хоть и не дешево … рекомендую 👍",5
"Отличный респектабельный отель. Был в качестве гостя на бизнес мероприятии. Масштабно, красивый сад рядом, прекрасный, красивый Холл, удобные конференц залы. Номера очень удобные и чистые. Потрясающий завтрак на любой вкус, игристое вино. Я остался очень доволен. Рекомендую...",5
"Плюсы: Приятный и вежливый персонал Обратная связь с персоналом Красивые помещения и украшения Большой и удобный номер Вкусные авторские коктейли в баре Красивый парк рядом Минусы: Сломаный тёплый пол в санузле Комментарий: Заселялись с супругой в отель на сутки. Удобно забронировали на сайте номер с регистрацией в их системе лояльности, за что предусмотрена небольшая, но приятная скидка. Перед заселением прогулялись по прекрасному парку Хуамин. Очень ждём, когда будут функционировать павильоны. Холл отеля выполнен великолепно. Большой просторный зал, приятные украшения. Сам отель выполнен роскошно, но без излишеств. Чем мне и нравится азиатская культура. Нет ничего вычурного и вырвиглазного. Всё очень эстетично и красиво. Мы с супругой буквально в восторге от антуража всего отеля от холла до номера, всё выполнено великолепно. Приятный и вежливый персонал. Нас зарегистрировали и мы сразу решили подняться в номер. В этот раз заселялись только на одну ночь без завтрака, так что отельную еду, к сожалению, оценить не могу. Однако авторские коктейли в баре были действительно хороши, одобряем большим плюсом. Причём меню это не просто альбом/книжка или ламинированный лист, а планшеты! Что тоже показалось нам очень удачным и интереснымрешением. Сам номер просторный, удобный. Есть рабочее место, куда можно разместиться с бумагами, ноутбуком и тд, кресло, мягкая лавочка, телевизор, тумбочки, и огромная кровать. Не хватает второго стула разве что, чтобы было удобнее сидеть за одним столом вдвоём. А то пришлось двигать ту самую лавочку без спинки, но это не критично совсем. Есть вода, маленькие десерты и чайный набор, кофе в стиках, сахар двух видов и подсластитель, по две бутылочки воды с газом и без. Причём попросили добавить воды, тк её не хватило для заваривания кофе с утра, тк простую воду выпили так и заварили чай. Принесли довольно оперативно и даже на одну больше, чем просили. Так же была проблема с тёплым полом в ванной. Сначала его не получилось включить, тк застрял тумблер переключения. Сообщили на ресепшн вечером, когда спустились вниз, пока мы ходили по холлу, изучали что где есть, отправили в номер инженера, чтобы он помог наладить работу. Вернулись, пол включен, отлично. Однако я заметил, что пол грел только одну плитку прямо под блоком управления, о чём так же сообщил утром следующего дня. Прислали инженера, он посмотрел и сказал, что либо строители допустили ошибку при прокладке пола, либо повредился контакт. Проблема не критичная, но вызвало некоторый дискомфорт, когда пользовались душевой и ванной, плитка холодная и находиться на ней без тапочек было, увы, некомфортно, пока обтирались. Порадовало большое количество разных уходовых и гигиенических средств. А в туалете, на критический случай, есть SOS кнопка. Удобная ванна, в которой есть кран-водопад и душ. Правда, пришлось некоторое время привыкать к ручкам смесителя, но ничего страшного. Кстати, так же есть соль для ванны, что порадовало. В душевой кабинке есть верхний душ и лейка с шлангом, что тоже очень удобно. Удобные выключатели света. И в нескольких местах есть мастер-выключатель, который гасит сразу все источники света. В кровати есть две индивидуальные лампочки для чтения. На халате заметил пару мелких пятен, но это меня не сильно смутило, всякое бывает. В общем и целом, номер комфортный и уютный. Яб в таком жил. Не хватает только микроволновки и плиты😁 Не смотря на мелкие недочёты, остались в большом восторге от пребывания в этом отеле и обязательно будем посещать в будущем. Спасибо персоналу за отзывчивость и оперативность!",5
"Красивый и большой отель, рядом парк",5
"Отель красивый, еда обычная персонал не очень приветливый",3
Отличная гостиница всё понравилось рекомендую всем 👍,5
"Отличное место, просторные номера, приятный сад во дворе.",5
"Крутой отель, все новое, современное. Чисто, аккуратно. Вокруг отеля красивый сад, всем советую сходить",5
Концепция на высоте!! Очень все красиво!! Вот увидел и сразу влюбился🥰 Смешение стилей Китая и современности! Очень современно!! Советую к посещению😎🇨🇳,5
"Конференция была в зале "" Шанхай"". Зал отличный, комфортный, уютный, прекрасная акустика. Угощения на кофе- брейк понравились, и оригинальные бутербродики и сладкие маленькие пирожные-пирожки- печеньки. О кофе надо говорить отдельно. Кофе пью редко, есть небольшие вопросы по здоровью, но здесь воздержаться было невозможно. О, капучино!!! С воздушной, но крепкой пенкой, с божественным ароматом.... мммм... Персонал почти невидим, неощутим. Сам отель и окружающая территория носит очаровательный оттенок Китая. Умиротворение ландшафта, сада камней, прудика с лотосами столь хорошо сливалось с теплом нынешних ярких осенних деньков, что ""послевкусие"" от посещения отеля не ушло и сейчас. Рекомендую.",5
"Побывала в саду камней,думала будет лучше,не впечатлил...",3
Крутой отель 🏩 хуамин китайский 🐲,5
"Номер понравился, правда в управлении разбираться пришлось. Дело привычки. Интерьер на высшем уровне. Завтрак замечательный. Вкусно, полезно. Настроение хорошее, я довольна.",5
"Частичка Китая в Москве!)) Территория отеля произведение искусства. Был тут на обучении, еда вкусная, обслуживание на высшем уровне.",5
"Всё хорошо! Идеальная чистота, девушки на ресепшене, в ресторане очень вежливые! Мужской состав в обслуживание в ресторане, очень хмурые, чувствуешь себя неловко. Необходимо серьёзно подходить к набору сотрудников и постоянное над ухом ""салаалейкум"" надоело!!!! Везде и повсюду, ещё и в таком отеле! Ужесточите отбор персонала!",5
"Очень красиво, вкусно готовят восьорг думала будет совсем подругому, но жалко конечно очень дорого 1 кабола за 15к вышла погулять очень красиво мотик, рыбки плавают красота (но очень дорого)",3
"Прекрасная твердая 5. Очень хорошее место для проведения конференций любого уровня. Большие просторные залы, отзывчивый персонал. Технически прекрасно оснащены , всё прошло без нареканий. Все экраны работали исправно. Рекомендую место, как эталон для конференций.",5
"Суперчистая и свежая гостиница для любителей Востока. Шикарные завтраки, в том числе и в европейском стиле никого не оставят равнодушным. Отдельно стоит упомянуть сад камней!",5
Очень красивое место. Настоящая 5-ка! Просто Luxury!,5
"Отличный отель! Рядом метро, магазины, кафе, великолепный парк... питание вкусное, разнообразные- есть все, что пожелаете: шампанское, фрукты, десерты, кофе, многотразных блюд",5
"Давно хотели попасть в этот отель, но всё время не удавалось забронировать номер, по причине отсутствия свободного. Наконец удалось его посетить. Отель новый, большой и красивый. Персонал вежливый и отзывчивый. Никаких проблем не возникало, таких, как были описаны в негативных отзывах. Дополнительную воду по просьбе принесли через 5 минут, рум - сервис так же порадовал, еду принесли быстро и вкусно приготовленную. Завтраки понравились. Есть всё необходимое для полноценного завтрака. Все продукты свежие и вкусные. Подходила менеджер, интересовалась всё ли нам нравится на завтраке, все ли предпочтения были удовлетворены. Это тоже приятно видеть, значит отель заботится о своих гостях. Огромный плюс (во всяком случае для нашей семьи) что у отеля есть своя территория для прогулок. Красивый китайский парк, где можно прогуляться и подышать воздухом с детьми. Парк ухоженный и чистый. В общем и целом нам отель понравился, будем останавливаться теперь в этом месте. Спа центры и фитнес в поездках нас не интересуют, а в остальном мы остались довольны сервисом. Единственный минус: платная парковка для всех, в том числе и постояльцев гостиницы. Это немного смутило, мы с таким столкнулись впервые. Хотелось бы, чтобы руководство отеля пересмотрела свои взгляды на этот момент.",5
"Прекрасный большой отель! Оставались там 08.09.24 в мой день рождения. Большой чистый и просторный номер. Персонал был приветлив и отзывчив. Обещали комплимент в честь ДР, но видимо забыли, но это не смогло омрачить прекрасного пребывания в этом отеле. Не много смутила стоимость парковки 1500 ₽ на сутки. С удовольствием вернемся сюда еще раз!",5
"Часто бываю в этом отеле . Снимаю часто свадьбы и многих своих невест из Хаята перенесла в этом году в Солюкс ! Отличные красивые и просторные номера , бесподобный парк и интерьер отеля ! Лучший! @photo_nirvani Мне очень нравится как пахнет в Холе , вот бы узнать что это за аромат ?",5
"Отличное новое интересное место. Особо хочется отметить сад в китайском стиле. Даже если просто прогуляться - очень советую. Приятное, комфортное место в Москве.",5
"Очень красивое атмосферное место ! В центре Москвы уголок настоящего Китая! Много раз бывала в Китае , есть с чем сравнить. Приятно прогуляться по небольшому уютному парку с его неповторимым китайским колоритом. Рекомендую для посетителей любого возраста ! :)",5
Выше всяких похвал!,5
"Все дорого, богато. Убранства поражают, но при этом чего-то не хватает. Пока не пойму чего именно. Но в целом норм отель 👍",4
"Красивый, современный отель в китайском стиле. Большие номера, с хорошей звукоизоляцией, транспортной доступностью, красивым китайским садом. Отличные залы для проведения мероприятий, многофункциональные, с прекрасными видами.",5
"Сервис на уровне, шикарные номера, вкусный чай в лобби, красивый интерьер. Вернусь вновь!",5
"Отель хороший! Чистые большие номера, отличные завтраки.",5
"Очень хороший парк и ресторан. В номерах пока не жил. Подача изысканная гёдза, суп с белыми грибами, свинина в кислосладком соусе с пореем и арахисом запеченная курица превосходные, а больше не смог пока попробовать.",5
Шикарно всё.,5
"Отель супер. Номер большой, завтраки на высоте. Удобное расположение",5
"Шикарное фотогеничное лобби, уютные современные конференц-залы, вкусная еда. А парк Хуамин - это сплошное эстетическое удовольствие!",5
Супер классное место) Локация для фото 🔥,5
Лучшая соотношение цены и комфорта,5
Современный отель с хорошими конференционными возможностями.,5
"Хорошая ""пятерка"" с восточным уклоном, отлично подходит для тематических мероприятий",5
"Шикарный отель шикарные номера, постоянно комплиментарное повышение уровня номера Попросил в баре в фойе лимонад принесли пол-литра льда, из которого слил 100 грамм лимонада собственно. При цене в 600 рублей хамовато получилось, но исправили ситуацию по первому тр",5
"Свеженько, чистенько, кормят хорошо",5
"Было мероприятие на 515 человек. Зал Пекин с этой задачей справился, экраны работали без помех. Единственное но- кондиционер. То дует так, что все замерзают, то очень душно. КБ проходили без задержек, все свежее. Официанты за кофе-машинами смотрят внимательно. Размещение достойное. Питание на такое количество людей, которым надо пообедатьв строго ограниченное время- разводили по разным зонам. Ещё в плюсы- парковка. Перед отелем можно поставить 3 автобуса одновременно и два автобуса на территории в ""кармане""- это удобно для трансферов.",5
"Вежливый персонал, просторные номера, удобное расположение. Рекомендую.",5
Отличное место!,5
Все на высшем уровне👍👌,5
"Все очень понравилось, особенно завтраки, просто шикарные",4
"Одна из супер современных гостиниц Москвы!!! Китайцы молодцы, все очень достойно!!! Бомбические завтраки!!! И есть китайский ресторан более чем!!!",5
Неплохо.,4
Полностью оправдывает название! Исключительно безупречно!,5
Чистые номера и хорошее обслуживание. Я рекомендую.,5
Великолепно!,5
"Прекрасный отель! Номера, сервис, персонал всё на уровне. Рекомендую",5
"Шикарный отель, с великолепными номерами и обслуживанием! Есть замечательный китайский садик, где можно погулять. Рекомендую.",5
"Excellent hotel. We stayed there for our wedding anniversary and we chose it for its position next to the Chinese park - we lived in China for six years and it brought our memories back. The hotel itself has an interesting touch of modern and traditional Chinese style. The hotel staff was friendly and they arranged a small cake for us waiting in our room. I requested a room with a view at the Chinese park and it was granted. The room was spacious, everything was clean and tidy. Breakfast had a large selection of food, including about ten Chinese dishes. Staff at the restaurant and especially at the reception was very helpful. They deserve praise. The only disadvantage of this hotel is the lack of a swimming pool and spa area as in other five-star hotels.",5
"Номер большрй и давольно, уютный. Чистый - относительно - не стерильный. Не хочется перечислять нюансы. Еда в ресторане - достойная. Вкусно, разнообразно. Много рыбы, фруктов есть мясо и веганам тоже найдётся чем перекусить. Персонал приветлевый, все отвечают с улыбкой и готовы идти навстречу в любом вопросе.",4
"Космос , а не отель ! Не пожалела ни на миг, отдыхала с дочкой в августе пару дней, восторг от всего, вид, номер, ресторан, кровать, душ… В ресторане отменная еда, грудку такую впервые пробовала, рекомендую от души ! Была потопив с водой, с душевой вода под дверью переливалась по полу в ванную, пришли девушки убираться , сообщила, пока гуляли , проблема была решена на 100% А какие тут завтраки ) есть все и даже больше ! Нет, рыбки красной не было и свежевыжатого сока ! Жаль ! Ну это так, что бы к чему-то придраться ! Вернусь к Вам ❤️",5
"Великолепное место, без преувеличений!!! И отель и локация) 15 минут пешком до ближайшего входа в ВДНХ, у самого отеля есть прекраснейший уютный парк в китайском стиле. И сам отель сделан в прекрасном стиле, очень помпезный, но при этом гармоничный холл. Так же много китайских мотивов. Замечательное обслуживание! Персонал превосходный!!",5
"Спасибо вам за мой восторг!❤ безумно приятно, когда даже мелочи из качественных материалов 🔥 ,в сочетании с обслуживанием на высшем уровне, вы вызываете бурю положительных эмоций!! Теперь в Москве останавливаться буду только у вас😊",5
Все супер рекомендую И метро рядом И персонал на высшем уровне,5
"Классный отель, завтраки вкусные, территория красивая",5
Лучший,5
