text,mark
"Стильно, модно, молодёжно. Но кондиционер за эту цену нужен. Наверное нам не повезло: пятница, жаркая ночь, открыли окно… в соседнем доме ночной клуб, публика высыпает покурить, громкие разговоры, песни музыка. Закрыли окно - тихо, но душно и жарко. Был бы кондиционер, не было бы проблем. А так - бессонная ночь. Но отель красивый, современный.",2
"Мне кажется в этом фото весь отель - так и не удосужились убрать малярный скотч после ремонта. Красивый фасад, но при детальном рассмотрении все не так радужно. Плюсы: + Расположение. В самом центре, можно дойти пешком куда угодно. Близко почти ко всем веткам. + У нас был хороший матрас. Не слишком мягкий, не слишком твердый. + Заселение в любое время + Есть кухонка и посуда + Бесплатная комната хранения багажа + На ресепшене с нами общались всегда вежливо и адекватно Минусы: - ОЧЕНЬ душно в номере. Нет никакой вентиляции, кроме окна. И тут сразу переходим к другому минусу - Отель выходит либо на дорогу с машинами и барами, либо на парковку машин и доставщиков. Наш номер это был просто флеш-рояль: машина перед самым окном и почти круглосуточная азиатская речь. - Высокая слышимость между номерами. - На потолке раз в минуту тихонько пищит динамик. Сделать с этим ничего не могут. - В туалете очень высокая влажность, на полу однажды был обнаружен лишний постоялец в лице мокрицы. - Уборщица взяла наш личный пакет со стола и засунула его в ведро в качестве мусорного. Странно, что не заставила нас его выносить. Забавно, что приветственное сообщение о всяких возможностях отеля, завтраков, вайфае и т.п. мне прислали сразу после того, как мы выселились) В общем, людям с берушами или проблемами со слухом в целом скорее можно рекомендовать. Если же критичен здоровый сон, то скорее нет.",3
"Очень хороший и красивый отель! Номера комфортные, всегда чисто. Удобно, что есть своя кухня с плитой, микроволновкой и раковиной. В коридоре есть кулер с горячей и холодной водой Если окна выходят на улицу(не двор),вечерами бывает шумно, но к ночи становится тихо.",5
"Чудесный отель. Вежливые администраторы, которые всегда подскажут и помогут с различными просьбами. Отличная шумоизоляция. Местоположение также очень удобно для тех, кто любит много гулять и выходить сразу в центр.",5
"Моя любимая сеть в Питере! Безумно красивый отель, персонал просто потрясающий, а в номере чисто и уютно. Вернёмся сюда ещё не раз!",5
"Коллектив отличный, завтраки достойные. Убирались постоянно, поэтому постоянно чисто! Спасибо девочкам, премию надо выдать!",5
"Бронировали отель на 3 ночи, 2 взрослых и ребенок 10 лет. Нам дали номер на последнем 4 этаже, это мансарда, была двуспальная кровать и евро-раскладушка, места достаточно. Персонал вежливый. При заезде я доплатила стоимость проживания плюс сбор за взрослых за 3 дня - 600 руб. Мы не брали завтрак, тк на этот адрес его просто привозят в лотках, не имеет смысла, вокруг полно отличных кафе/ресторанов, которые работают с 8-9 утра. Телевизор не включали, не могу ничего сказать, вода горячая была утром и вечером, напор не очень, но вполне комфортно. Совсем рядом с центром, канал Грибоедова прямо за углом дома. Перед отелем платная городская парковка, всегда свободно, во дворе отеля бесплатно, плотно, но мы всегда находили место. Номера чистые, уборка каждый день без проблем, смена полотенец. Это всё плюсы. Теперь минусы, и для меня они перевесили все плюсы(( 1. У нас окна выходили на Банковский переулок, спать очень тяжело из-за пьяных криков, музыки, песен, газующих машин, и так до самого утра 2. Полное отсутствие вентиляции, духота жуткая, при том, что на улице ночью +18. Мы просыпались все мокрые, боюсь думать, как там жить при +30. 3. Из-за духоты окно мансарды приходилось открывать, сетки на нем нет, и залетало дикое количество комаров и мошкары даже в темноте. Мы брызгались на ночь средством, и всё равно меня и ребенка искусали жутко((( все стены номера в пятнах крови, тк все жильцы, видимо, охотились на комаров. В общем, кроме центрового расположения особых преимуществ у отеля нет, жить там некомфортно, я не смогу его порекомендовать.",3
"Однозначно приеду сюда ещё раз, расположение удобное, центр города, приветливый персонал и стильный дизайн номера. Уютно, чувствуешь себя как дома, мне очень понравился этот отель) окна в пол придают сказочную атмосферу отдыха. В номере чисто, убирались каждый день, даже посуду мыли за нас)))",5
"Уютно. В шаговой доступности Казанский собор, Спаса на Крови, Невский проспект. Обязательно сюда вернёмся",5
Уютно и по домашнему,5
"Прекрасный отель в центре Питера. До всех достопримечательностей пешком от 5 до 20 мин.: Казанский, эрмитаж, русский музей, спас на крови, исакий, невский, летний парк, марсово поле и т.д. до всех них пройти совсем недалеко) До Петропавловки только пару оставок на метро, но это как дополнительная возможность посмотреть метро) Номер очень хороший, все есть, и чайник и посуда и ножи и холодильник т.д. У нас был ""комфорт"", на 3 эт, лифт есть. Фото номера на сайте отеля есть. В отеле ночью тихо и за окнами тоже, прекрасно высыпались! С водой проблем нет. Единственный минус отсутствие кондиционера( есть вениилятор, но не особо помогает, да и при открытом окне комары закусали. Сеток на окнах нет( уборка каждый день, хорошая. Персонал приветливый, всегда подскажут если есть вопросы. Отдельное спасибо за возможность позднего выезда абсолютно бесплатно! Однозначно рекомендую этот отель! При установке кондицирнеров во всех номерах с удовольствием остановимся еще раз и в летнее время)",5
Отличный отель. Все просто супер. Расположен в одной минуте от одной из достопримечательностей Петербурга - Банковского моста с грифонами. Номера на любой вкус и кошелек. Отличное обслуживание. Ежедневная уборка. Всем спасибо за наш хороший отдых.,5
"Отличный отель! Отличное за свои деньги расположение, уютные номера, всё необходимое уже есть в комнате. Единственный минус - нет кондиционера, но вместо него стоит вентилятор, который тоже немного спасает от духоты.",5
"Очень хорошая, уютная гостишка! Нам очень понравилось. Вернёмся туда ещё!👍🏼",5
"Шикарные номера, шикарный персонал, замечательное расположение, все очень порадовало. Огромное спасибо!",5
"Из минусов: нет кондиционера, только вентилятор. Из плюсов: почти центр города, всё очень близко.",4
"В номере чисто,мини кухня,центр, рекомендую, вернёмся обязательно, у супруга был день рождения подарили бутылочку шампанского,приятно ,все понравилось!!!",5
"Были в СПб с 20 по 28 июля 2024 года. Номер 104 (первый этаж. это важно). Расположение вполне удачное. Сам отель чистый и вполне современный. Есть кухонька с холодильником даже в самых малых номерах. Кондиционер есть только в более дорогих номерах, а потому дальше о недостатках: Открывать окна практика неплохая, но именно номер 104 расположен на первом этаже окнами во внутренний дворик, в котором постоянно ""зажигают"" доставщики. Всё курево у вас в номере, вся очень громкая музыка и разговоры - у вас в номере. Ругаться небыло большого смысла, так как пока очухаешься ото сна, они уже уехали ""на задание"" и приезжают новые. Если бы не курево, музыка и разговоры до самого утра, то номер вполне хороший и тихий.",4
Удачное расположение. Чисто. Аккуратно. Уборка каждый день. Лифт. Круглосуточный ресепшн. Отвечают на запросы. Из минусов - не во всех номерах кондиционеры (но есть вентилятор),5
"К сожалению, разочаровал отель, минусов множество: 1. При бронировании указывали, что необходимы раздельные кровати. В итоге - одна кровать. Менеджер на ресепшен попытался решить вопрос: раздвинуть и заправил кровати, но когда раздвинуть кровати, там лежала чужая тапочка. Значит, в номерах плохо убирают 2. Ночник над кроватью отвалился 3. Отвалилась лейка душа Утром по всем этим пунктам беседовали с менеджером на ресепшен, должны были в течение дня устранить, в итоге с душем вопрос решили, а со светильником нет. Плюс ко всему постоянный шум под окнами: такси, доставили. Круглые сутки В данный отель не вернёмся и не будем рекомендовать знакомым",1
"В номерах чисто аккуратно, обслуживание норм. Расположение , в шаговой доступности метро,центр. Нету своей столовой это минус, хорошо что есть радом соловая по этой же улице.😀👍🖕",5
"Хороший отель, есть все что нужно, в отличном месте не далеко от метро.",5
"Хороший отель, удобное расположение, 5 мин до Казанского собора.но есть но всю неделю была жара 30, в номере кондиционеров нет, стоит только вентилятор но толку от него мало. Окна выходили во двор, где 24 /7 собирают заказы на доставку, поэтому граждане ближнего зарубежья гутарят под окнами всю ночь, та к что открыть окно не вариант.",4
"Очень приличный отель не далеко от центра. Приветливый персонал, очень отзывчивые молодые люди на ресепшен. Единственный минус летом достаточно жарко в номерах без кондиционеров. Номера очень чистые, просторные. Кровати удобные. Если хотите отдохнуть и иметь возможность быстро попасть в центр и в любое время вернуться в отель, то вам именно сюда.",5
"Все отлично, но в ванной не работал фен, выключался каждые 15 секунд. Также не работала сушилка.",4
"Небольшой уютный отель. Очень понравилось то что не слышно соседей от слова совсем. Даже учитывая что за стеной был бар. Сервиз отличный. Персонал приветливый. Уборка в номере на отлично (к примеру: забыли помыть посуду перед уходом, пришли посуда чистая). Наше чисто субъективное мнение отель отличный. И самое главное все в шаговой доступности от магазинов и столовых до музеев и развлечений.",5
"отдыхали в этом отеле с 17.07-21.07, если это можно назвать «отдыхом», жили на 4 м этаже окна выходят на сторону банковского переулка и это капец товарищи, рядом с отелем бар и там как вы понимаете всем все равно, что вы отдыхаете да и мы понимаем это - сами были молодые)) но это ооочень омрачает отдых, так же читайте внимательно описание номера - в нашем не было кондиционера, но как?? в наше время сейчас везде мне кажется он есть, шпарило от крыши, по мимо духоты в целом, в вообщем, бронируя номер в izzzi на Банковском, учитывайте, что отдохнуть может не получиться! Но Питер сам прекрасен!",2
"Бомбическая гостиница! Всë на высшем уровне, начиная от расположения до сервиса. Так держать! Во всех сетях сделала рекламные посты! Рекомендую!",5
"Все хорошо,сняла звезду за шум,номер был на первом этаже во двор,там яндекс лавка и всю ночь подъезжают машины,ор,шум.Но это была жара,при закрытых окнах наверно норм.А сам отель и нлмер и условия и расположение просто супер.",4
"Очень удобное расположение, в шаговой доступности Дом книги и Казанский собор. Чистота в номере, приветливый персонал. Рекомендую.",5
"Номер для двоих в самый раз, интересный дизайн. Рядом с центром. Чисто и уютно. Нам с подругой понравилось",5
Все отлично.рекомендую,5
"Классный отель, отзывчивый персонал, удобное расположение",5
"Жили в номере категории SUPERIOR в июне 2024. Плюсы: - удобное расположение, рядом с Невским и всеми основными достопримечательностями + метро тоже рядом - размер и планировка номера (метраж не очень большой, но все удобно) - есть мини-кухня со всем необходимым: плита, холодильник, набор посуды - очень удобно - чистота; ежедневная уборка; очень чисто в ванной - нормальная шумоизоляция внутри отеля (не слышно было никого из соседей), для Питера это редкость) - мы приехали чуть раньше, нас без проблем заселили; учли пожелания по типу кроватей Минусы/нюансы, на которые стоит обратить внимание: - у нас был первый этаж, рядом несколько баров; из-за жары окна всегда держали открытыми (нет кондиционера) - было шумновато - Нет воды в номерах (есть чайник в номере и кулер с питьевой водой на этаже) В целом по соотношению цена/качество отель на 5+",5
"Преимущества отеля: расположение в центре, в нескольких минутах от Банковского моста на Грибоедовском канале, мини-кухня в семейном номере, хорошая уборка, в целом приятный дизайн. Минусы: соседствует с кальянной-кафе, в котором до 5 утра играет клубная музыка, наш номер был ближайший к нему, спать было затруднительно из-за басов за стенкой, также они выставляют столики на улицу, прямо под окна отеля, весь смех и веселье - в номере.",3
"Хорошее расположение. Многие достопримечательности рядом. Чисто ,уютно. Фишка с кухонным набором зачётная. Жили неделю на 4ом этаже. Лестница, лифт -проблем нет. Вода питьевая на каждом этаже.",5
"Комфортное пребывание. Вежливый персонал. Была Алина. Близко к Невскому проспекту.Наличие камеры хранения. Рекомендую.В номере чисто,комфортная кровать,наличие посуды для чая и приготовления пищи.Нахождение 7-10 минут от метро Невский проспект.",5
"Все хорошо , кроме отсутствия кондиционера",4
"Не смотря на то что все пошло не так с самого начала отель хороший,номер большой, жаль нет кондиционера,жили на первом этаже,окна открыть не сильно могли слышимость конечно супер под нашими окнами и грузили что в 6 утра и молодежь курила и ржала .выбирайте этаж выше .",5
"Очень комфортно, рядом с центром уютный номер . Спасибо, буду рекомендовать знакомым .",5
Плохая шумоизоляция. Спать невозможно. Пахнет канализация.,2
Симпатичная гостиница,4
"Отель оправдывает свою цену и звезды. Понравилось - вежливость персонала, чистота в номере (убирали даже когда не просили). Не понравилось - нет вентиляции в номере и туалете-душевой, проблемы с регулировкой окна, держатель душа не работает.",3
"Прекрасный отель, супер персонал",5
Нет кондиционера в номере за 9тыс₽,1
"Бронировали 3 номера на Банковском на одни сутки. Была приятно удивлена чистотой в отеле. Номера чистые, уютные, постельное белье белоснежное. В номере есть мини кухня и посуда. Можно приготовить еду, особенно актуально, если путешествуешь с детьми. Заселение в отель с 14:00, мы приехали в 8:00 и попросили оставить вещи в камере хранения. Но нам предложили вариант намного лучше! Так как один из номер был уже свободен и вымыт, нас засели сразу без всякой дополнительной оплаты. Персонал отеля вежливый! Рекомендую данный отель!",5
"Оч милый отель, отличное расположение до спаса на крови минут 15 пешком, до казанского 5. Понравился номер, чистый продуманный, все необходимое есть.",5
"Хороший отель. И расположение, и чистота, и удобство номеров. Клиентоориентированность персонала радует.",5
"Отличный отель почти в самом центре. Тихое место. Чистые уютные номера. Каждый раз когда бронирую, выбираю это место. У ребят несколько адресов, но на Банковском удобнее всего!",5
"Отличная гостиница в центре. Шаговая доступность до всех знакомых мест. Тихо в номерах, даже с клубом на первом этаже",5
