text,mark
"Из плюсов: - местоположение - стоимость - чистота, состояние номеров, отсутствие посторонних запахов, плесени в санузлах и т.д. Из минусов: - Перед бронированием за 10-14 дней звонили уточнить количество свободных номеров, этажи. Представители отеля сказали напишите при бронировании в комментариях какой вам этаж, кровать, прочие пожелания. Номеров сказали на выбранные даты много и у вас при бронировании сейчас будут учтены все пожелания. По итогу при регистрации в отеле сказали номер только на 1 этаже, система распределяет автоматически, обещали на следующий день переселить на другой этаж, но этого не произошло. Номер на 1 этаже с выходом во внутренний двор это то еще приключение - во дворе несколько офисов, постоянно приезжают / уезжают автомобили, а главное - во дворе яндекс лавка, постоянно, с 6 до 22 часов курсируют курьеры, шум, что накладывает неприятное впечатление.",3
Наличие ночного бара по соседству и отсутствие кондиционера это ужас,2
"Вид из окна, забота о тех, кто заселяется поздно - разложили кресло и постелили постель, наличие зубного набора и тапочек, наличие всего необходимого для кухни и приветственный чай, кулер с чистой питьевой водой, утюг. Удобное раскладное кресло. Наличие багажной комнаты - это очень удобно! Близость к метро и возможность пешком дойти до основных достопримечательностей. Стильная обстановка. Напоминает ibis/azimut Но гораздо дешевле, с кухней и доп. спальным местом Из пожеланий - не заходить персоналу в номер без стука, даже если есть карта. Проверка выехали/не выехали не так осуществляется 🙏🏼 Разобраться с щелчками электричества (как будто или автомат срабатывает или электронный замок щёлкает) Из-за щелчков почти не спала. Разбираться некогда было. Заехали очень поздно, дети отрубились",5
"Понравилось 1 место расположения, 2 чистота, 3 вежливость персонала, 4 удобный чат в вотс где можно задать любой вопрос 🫶 НО есть одно но и оно оказалось для меня критично - бар Неон на 1 этаже и вообще внутри здания по всей длине 😓 у кого чуткий сон 💤 то вам будет не очень комфортно, но в номере заботливо лежат беруши 🥲 музыка орет с двух сторон как бы менять номер мы не стали, те если (у нас окна во двор) во дворе персонал выходит в курилку и орет как не в себе то снаружи (окна на дорогу) орут как не в себе посетители данного заведения 🙈 пьют, курят и бьют бутылки 🥲 как бы отель тут не при чем но неудобство было к сожалению(( спать нереально было 🌚",4
"Очень удобное расположение и приятный интерьер. Но, к сожалению, главную функцию - хорошо высыпаться по ночам - отель выполнить не смог. Очень шумный двор при открытом окне, а при закрытом окне в номере можно задохнуться. (Возможно, в более прохладное время года это будет не так заметно)",4
Очень классно.,5
"+ Расположение норм, интерьер норм, кровать супер, большое окно супер - Высокая влажность из-за отсутствия кондиционера; душевая кабинка без бортиков, вода течет на пол; не убрали мусор после предыдущих гостей перед нашим заселением",3
"Комната была тесная , заставленная большими стульями которые туда еде помещались ; В номере было очень жарко , мы попытались открыть окно, которое оказалось очень большим и совершенно без страховки , если бы у нас были дети они могли бы спокойно вывалиться из этого окна , даже нам взрослым было страшновато ; Нам показалось что номер описанный в сайте не соответствует описанию",2
"Добрый день! Отличный отель во всех смыслах этого слова, от чистоты в номере до удобного расположения в историческом центре Петербурга. В номере есть всё для комфортного отдыха, уборка проводится регулярно. На этажах установлены кулеры с питьевой водой в постоянном доступе. Персонал вежливый, доброжелательный. Рекомендую на 💯 процентов всем, в том числе тем, кто хочет посмотреть достопримечательности культурной столицы, передвигаясь пешим ходом. Спасибо Вам за отличный отдых! Если в Петербург, то только в Izzzi!",5
"Отличный отель, чисто, уютно, современно, красиво, идеальное расположение. В номере есть все необходимое, уборка ежедневно, горячая вода без проблем, есть стиральная и сушильная машины (за отдельную плату). На этаже кулер, гладильная доска с утюгом. В холле кофемашина. Все понравилось, без нареканий. Обязательно остановлюсь тут в следующий раз.",5
"За свои деньги, очень приличный отель расположенный в самом центре города. В номерах есть все необходимое, приятно удивило наличие полностью оборудованной кухни. Из минусов в номерах нет кондиционеров.",5
"Мы жили в номере 111, за стенкой бар Неон. А с самого утра под окнами начиналась разгрузка продуктов и от мата грузчиков уши в трубочку сворачивались. И это был единственный номер для семьи с ребёнком??? Администрация не в курсе, что происходит под окнами их отеля? Кроме того регулярно кто-то курил прям под окном. Неужели нельзя хотя бы повесить таблички с просьбой не курить??? Наверное отель не плохой, если можно выбрать не первый этаж с окнами не на дорогу. Но нам к сожалению не повезло.",3
"Прекрасный отель. Стиль , удобство , все мелочи предусмотрены. Рядом метро",5
"Прекрасный отель в самом центре города, современно, чисто, стильно 👍🏼",5
"Отель в целом не плохой. Но он расположен рядом с ночным клубом, так что спать до 4 утра практически невозможно, бируши не помогали, тк в комнате от звука все вибрировало. Либо ночной клуб -либо отель: в наш визит победил ночной клуб (был видимо через стенку). Завтрак по системе шведский стол не рекомендую, качество как в плохой столовой. Так что достойные 3 бала за 3 звезды.",3
"1. При заселении было грязное мусорное ведро в санузле, бумага с красными пятнами. 2. При смене постельного белья поменяли на грязное с пятнами. 3. Не обновляли зубные щетки с пастой. 4. Окна смотрят во двор на трансформаторную подстанцию, от нее шум. 5. Попросил выезд на 1-2 часа позже, администратор сказала 8 тысяч как за ночь. Потом сказала «ладно, 3». Подошел на следующий день, другой администратор разрешила выселиться на час позже бесплатно. Плюсы: 1. Расположение 2. Вода, гладилки в коридоре. 3. Интерьер По хорошему поставить бы оценку 3. Но в целом впечатление больше положительное, поэтому 4. Но нужно поработать.",4
"Плюсы - центр города, цена номера, есть кухня, стиралка и сушилка на этаже, есть кровать для ребенка, каждый день убирают минусы- нет кондиционера, в номере ад. Рядом клуб, долбит музыка с 22.00-5.00. Вы не сможете спать. Кровати скрипят, соединены из двух, между дыра, утюг ржавый , доска вся в пятнах, администраторов нужно всех поменять, пришли делать кровать, просто подложили картонку и ушли😂😂 Подушки не удобные, спина болела . Итог. Не спал ни одну ночь из за музыки и жары и кровати.",3
"Отличный отель, чистенько и свежо! Расположение супер и проблем с парковкой нет) Единственный минус, то что нет кондиционера.",4
"Хорошой отель, в номере есть почти всё (холодильник, плита если кто в спб готовить хочет, шкаф). Приятный персонал. Большие панорамные окна (хотя панорама на даркстор лавки или шумную улицу) Есть опции завтраков, но их не брали. Но! Нет сплит системы (?!? Вместо стоит еле устойчивый вентилятор!), держатели душа не держат лейку, сами ванные убитые, полотенца серые и тонкие, кровати не удобные. И политика ценообразования. Номер на ночь стоит 7000₽ (супериор). В продление номера на полдня - 11000₽, что в целом вне реальной цены для вторника для гостиницы без сплита и трех звезд. Ощущение что обманули очень сильное. Осадок остался крайне неприятный. Резюмируя: в целом, неплохой вариант. Но будьте внимательны, внутри отеля норовят обмануть.",2
"Уютный отель, красивый интерьер, отличное расположение . Номер smart , для двоих взрослых, вполне достаточно, достойный номер, убирались каждый день, полотенце меняют по запросу. Есть небольшая кухня с Эл. плитой, вытяжкой, чайник, холодильник, посуда. На этаже гладильная доска, стиральная и сушильные машинки. Есть лифт, жили на 4 этаже. Очень понравилось. Пишут насчёт шума, спали с открытым окном, музыки не слышали, шума всю ночь тоже не было, окна были во двор. На рессепшене все вежливые, приветливые. Очень понравился отель, рекомендуем100%",5
"Много пишут про плюсы отеля - близость к центру, хорошая уборка, и мы с ними согласны. НО мы столкнулись с жирным минусом - нам дали номер, который стенка-в-стенку примыкает к кальянной, работающей по принципу ночного клуба: до 5 утра и со столиками на улице прямо под окнами номера (в полуметре от окна они ставили бумбокс - хорошо наверное гостям этого кафе, правда?). Ребята на ресепшене пытались как-то решить проблему: например, по нашей жалобе просили администрацию ночного клуба пересадить шумных гостей прямо от нашего окна на 2 метра подальше (что на 10% уменьшало слышимость), но в целом проблема не решалась, тут проблема в принципе в том, что номер - это буфер (саундбуфер!) между ночным клубом и остальной частью отеля. Нам приходилось закрывать окна в жару, кондиционеров нет, с нами - 6-летний ребенок... Вопрос менеджеру отеля: если изначально известно, что у есть в наличии такой проблемный номер, то зачем его сдавать, тем более гостям с ребенком?",3
"Удобное местоположение, приятный интерьер, чистота в номере и наличие всего необходимого",5
"Спасибо за прием, приветливый и вежливый персонал. Удобное расположение, в номере есть все необходимое, уютно. Очень красивое лобби, сделали фотосессию в день свадьбы.",5
"Ужасный отель, особенно номер 102, кондиционера нет, окна во двор, шум от курьеров, всю ночь их музыка с заказами, утром ругань и драки, хлопанье дверей! Не приветливый ресепшен, ни поздороваться ни пожелать доброго вечера, я гость, хоть немного внимания можно? Никакой отель, одним словом, не рекомендую и второй раз точно не вернусь.",1
"Все отлично, учли наши пожелания, единственный минус - нет кондея, а вентилятора нам не досталось. Мы попали в самые жаркие дни",5
"Идеально! Есть все удобства для проживания. Чисто, красиво и современно",5
"Прекрасный отель. Все четко . Отличное расположение в центре , все в пешей доступности. Номер небольшой, но все очень продумано, белье чистейшее. Удобно , что есть мини кухня , санузел чистый современный. Ресепшен работает отлично, приветливые и все оперативно решают. Рядом Буше,Марчеллис справа от Казанского собора. Можно кушать и наслаждаться видом. От отеля 5 минут . В пешей доступности ВкусВилл, булочная Вольчек . 😍",5
"Удачное расположение- до Казанского 5 мин. Номер был супериор. Удобные матрасы, хорошее постельное. Подушки тонюсенькие. Номер убирали каждый день. В ванной мыло в дозаторе, есть шампунь и гель для душа. На этаже гладильная доска с утюгом (бесплатно) и кулер с водой. Раньше 14 не заселяли. Но есть багажная комната. Девушка-блондинка администратор была раздраженная, иногда отвечала грубо посетителям. Вторая девушка (темненькая) и молодой человек приятные. У нас был номер на 1м этаже с окнами во двор. Под частью окна располались столики кафе. Днём играла музыка, но нас почти не было, а после 23 музыку выключали. Но кафе работает до 6 утра. Это не очень уютно, все время шторы в номере держали закрытыми. Если есть возможность, селиться лучше не на 1 этаже. Кондиционера нет. На улице было около 20 гр, в номере при закрытом окне очень душно. Открытое окно спасает, есть сетка на окне. В целом недочёты у отеля незначительные, из-за расположения на них можно закрыть глаза.",5
"Были приятно удивлены, большой номер, чисто , уютно. Уборка проводилась ежедневно, персонал весь дружелюбный. Самое главное местоположение, до любой точки можно дойти пешком.",5
"Однозначно этот отель заслуживает хорошей оценки! 1) это местоположение (самый центр, выходишь и сразу Казанский собор) 2) несмотря на то, что отель в центре, здесь очень тихо. У нас номер был на 1 этаже и открытые окна выходили во двор и очень тихо, хотя рядом бары. Мы отлично выспались. Хорошая звукоизоляция, мы не слышали ни ресепшен, ни соседей (номер 101) 3) хороший свежий современный ремонт, чисто, в номере есть все необходимое для отеля 3*, убирали каждый день. 4) соотношение цена качество отличное. Рекомендую!",5
"Второй раз останавливаемся в этом отеле. Очень нравится! Место расположения, номера, удобные кровати, обслуживание. Всё на отлично 👍Однозначно будем останавливаться только в нём. Все отели , в которых мы были ранее , здорово проигрывают.",5
"Просто великолепное местоположение. Не плохие номера, достаточно чисто, есть кухня. Теперь минусы: Нет кондиционера, сторона у номера солнечная, в номере очень душно. Ко всему прочему очень шумно, под окном курьерская служба которая и днем и ночью хлопает дверьми, ночью спать не возможно с открытым окном, а если его закрыть то маешься от жары. Не вернусь сюда только из-за шума. Возможно не все номера такие но проверять я не стану 😅",3
"Хороший отель: расположение крайне удобное и в целом номер и отель приятные. Однако плохо с вентиляцией - очень душно, окно не закрывала вообще. Удобно, что есть своя мини-кухня, но грязная посуда, из-за чего очень неприятно (и губки для мытья нет). «Вид» - это какие-то контейнеры во дворе. И из-за того, что на 1 этаже номер, было немного неуютно и не чувствовалась безопасность (особенно, когда доносятся звуки не вполне трезвых людей). Но это не умаляет достоинств отеля.",4
Отличный отель. Все понравилось. Очень удобное расположение - все в шаговой доступности.,5
"Хорошее расположение, все достопримечательности близко. Останавливались в номере с небольшой кухней (есть СВЧ, плита, посуда на 2, сковородка, кастрюля), номер маленький, но все необходимое есть. Но большой минус, нет кондиционера. Если жарко, то приходится открывать окна, на улице клуб и бар, поэтому очень шумно ночью.",4
"Очень теплый по домашнему отель. Отзывчивый персонал. Есть доставка завтраков, обедов и ужинов в номер. Можно в отеле выбрать и оплатить экскурсию .В номере , всё есть для домашнего проживания: маленькая кухня с плитой, микроволновкой, холодильником и кухонными приборами. Уборка в номере каждый день. Шаговая доступность до центра и метро. То, что нужно для туристической поездки в Питер!",5
"Отдыхали в этом отеле второй раз в мае. Но на этот раз выбрали неудачный номер smart - он ооочень маленький, вентиляция не очень работает, кондиционера нет. Была солнечная сторона и приходилось держать окно открытым, но окно выходило на улицу, где ожидали выдачи курьеры Яндекс лавки. Было громко с утра и до позднего вечера. Дым от сигарет шёл в окно т. к. воторой этаж, и постоянно хлопала дверь в Яндекс Лавке. В остальном только плюсы, свежий ремонт, стильно, чисто. Просто нужно брать другой номер.",4
